URL,Version,Status,OIDs,Name,Title,Descriptino,Uses,Used,Sources
https://fhir.ee/ValueSet/ametite-klassifikaator,2025-03-27,active,"1.3.6.1.4.1.28284.6.2.3.1,1.3.6.1.4.1.28284.6.2.3.1.4",AmetiteKlassifikaator,Ametite klassifikaator,"„Ametite klassifikaator“ (AK) on Eesti-sisene klassifikaator, mis põhineb Rahvusvahelise Tööorganisatsiooni (ILO) hallataval klassifikaatoril International Standard Classification of Occupations ISCO-08. Klassifikaatorit kasutatakse selleks, et esitada, võrrelda ja vahetada statistilisi ja administratiivandmeid nii Eestis, Euroopa Liidus kui ka laiemal rahvusvahelisel tasemel. Ametite klassifikaatoris on ametid liigitatud selgelt määratletud rühmadesse töö sisu, tööga seotud ülesannete ja nõutava kvalifikatsiooni alusel. Hierarhilises klassifikaatoris on viis taset. Esimene kuni neljas tase järgivad täpselt rahvusvahelist alusklassifikaatorit, kus iga ametirühma kohta on esitatud lühikirjeldus ja peamiste tööülesannete lühike loetelu. Viies tase, mis sisaldab ametinimetusi, on loodud Eesti vajadustest lähtudes ja täieneb pidevalt. Klassifikaatori struktuur: 1. tase — 10 pearühma; 2. tase — 43 allpearühma; 3. tase — 131 allrühma; 4. tase — 436 ametirühma; 5. tase — pidevalt täienev ametinimetuste loend.  Klassifikaator on leitav [Statistikaameti kodulehelt](https://klassifikaatorid.stat.ee/item/stat.ee/b8fdb2b9-8269-41ca-b29e-5454df555147/57)","StructureDefinition/ee-health-certificate-occupational-employment","Other"
https://fhir.ee/ValueSet/arsti-otsus,1.0.0,active,"1.3.6.1.4.1.28284.6.2.1.259,1.3.6.1.4.1.28284.6.2.1.259.1",ArstiOtsus,Arsti otsus,"Arsti otsus patsiendi poolt taotletud tervisetõendile - patsiendi terviseseisundi vastavus kehtestatud tervisenõuetele. Lisaks kasutatakse antud loendit E-labori projektis laboritest analüüside tellimisel.","StructureDefinition/ee-health-certificate-decision","Other"
https://fhir.ee/ValueSet/toost-olenevad-ohutegurid,1.0.0,active,"1.3.6.1.4.1.28284.6.2.3.22.1,1.3.6.1.4.1.28284.6.2.3.22",ToostOlenevadOhutegurid,Tööst olenevad ohutegurid,"Rasedakaart - raseda töökohast olenevad ohutegurid: füüsikalised, keemilised, bioloogilised, füsioloogilised ja psüholoogilised, ja kantserogeenset ja mutageenset ohtu põhjustavad tööprotsessid.","StructureDefinition/ee-health-certificate-work-related-risk-factor","Other"
https://fhir.ee/hcert/ValueSet/ee-health-certificate-driver-category,1.0.0,active,,EEHealthCertificateDriverCategoryVS,Mootosõidukijuhi tervisetõend kasutusala,"Tervisetõend kasutusala mis on mõeldud kasutamiseks mootosõidukijuhi tervisetõendis","StructureDefinition/ee-health-certificate-driver","Other"
https://fhir.ee/hcert/ValueSet/ee-health-certificate-status,1.0.0,active,,EEHealthCertificateStatusVS,Tervisetõendi staatus,"Staatuste loend millega opereerib HCERT teenus","StructureDefinition/ee-health-certificate","hl7.fhir.r5.core"
